<!DOCTYPE module SYSTEM "module.dtd">

<module name="trigger_ext" dir="core">
  <header>
    <file name="trigger_ext.h"/>
  </header>
  <init fun="trigger_ext_init()"/>
  <makefile>
    <file_hw name="trigger_ext_hw.c"/>
    <file name="trigger_ext.c"/>
    <flag name="TRIGGER_EXT"/>
    <flag name="TRIG_EXT_PULSE_TYPE" value="TRIG_EXT_EDGE_FALLING"/>
  </makefile>
</module>

