<!DOCTYPE module SYSTEM "./module.dtd">

<!-- 

// Use (parts of) the following section in airframe file to change 

  <section name="DIGITAL_CAMERA" prefix="DC_">

    <define name="PUSH" value"LED_ON" />
    <define name="RELEASE" value"LED_OFF" />

    <define name="AUTOSHOOT_QUARTERSEC_PERIOD" value="6" unit="quarter_second"/>
    <define name="AUTOSHOOT_METER_GRID" value="50" unit="meter"/>
  </section>

# ap.CFLAGS += -DGPS_TRIGGERED_FUNCTION="dc_shoot_on_gps" 
# ap.CFLAGS += -DDC_GPS_TRIGGER_START=1 
# ap.CFLAGS += -DDC_GPS_TRIGGER_STOP=3 

-->

<module name="digital_cam">
  <header>
    <file name="led_cam_ctrl.h"/>
  </header>

  <init fun="led_cam_ctrl_init()"/>

  <periodic fun="led_cam_ctrl_periodic()" freq="4" autorun="TRUE"/>

  <makefile >

    <flag name="DIGITAL_CAM" />
    <file name="led_cam_ctrl.c"/>
    <file name="dc.c"/>
      <flag name="SENSOR_SYNC_SEND" value="1" />

  </makefile>


</module>

