<!DOCTYPE module SYSTEM "module.dtd">

<module name="trigger_ext" dir="sensors">
  <header>
    <file name="trig_ext_hw.h"/>
    <file name="trigger_ext.h"/>
  </header>
  <init fun="trigger_ext_init()"/>
  <periodic fun="trigger_ext_periodic()" freq="10"/>
  <makefile>
    <file_hw name="trig_ext_hw.c"/>
    <file name="trigger_ext.c"/>
    <flag name="TRIGGER_EXT"/>
    <flag name="TRIG_EXT_PULSE_TYPE" value="TRIG_EXT_EDGE_FALLING"/>
    <flag name="TURBINE_ID" value="42"/>
    <flag name="GPS_TIMESTAMP"/>
  </makefile>
</module>

